{"$schema": "http://json-schema.org/draft-04/hyper-schema#", "type": "object", "properties": {"complete": {"type": ["boolean", "null"]}, "$uri": {"pattern": "^\\/api\\/v1\\/analyses\\/[^/]+$", "readOnly": true, "type": "string"}, "created_at": {"readOnly": true, "type": "string", "format": "date-time"}, "success": {"type": ["boolean", "null"]}, "sample": {"additionalProperties": false, "type": "object", "properties": {"$ref": {"pattern": "^\\/api\\/v1\\/samples\\/[^/]+$", "type": "string"}}}, "job": {"additionalProperties": false, "type": "object", "properties": {"$ref": {"pattern": "^\\/api\\/v1\\/jobs\\/[^/]+$", "type": "string"}}}, "analysis_type": {"type": ["string", "null"], "maxLength": 50}, "error_msg": {"type": ["string", "null"], "maxLength": 255}}, "links": [{"href": "/api/v1/analyses/schema", "method": "GET", "rel": "describedBy"}, {"targetSchema": {"items": {"$ref": "#"}, "type": "array"}, "href": "/api/v1/analyses", "method": "GET", "rel": "instances", "schema": {"additionalProperties": true, "type": "object", "properties": {"sort": {"additionalProperties": false, "type": "object", "properties": {"complete": {"type": "boolean", "description": "Sort by complete in descending order if 'true', ascending order if 'false'."}, "$uri": {"type": "boolean", "description": "Sort by $uri in descending order if 'true', ascending order if 'false'."}, "created_at": {"type": "boolean", "description": "Sort by created_at in descending order if 'true', ascending order if 'false'."}, "success": {"type": "boolean", "description": "Sort by success in descending order if 'true', ascending order if 'false'."}, "sample": {"type": "boolean", "description": "Sort by sample in descending order if 'true', ascending order if 'false'."}, "job": {"type": "boolean", "description": "Sort by job in descending order if 'true', ascending order if 'false'."}, "analysis_type": {"type": "boolean", "description": "Sort by analysis_type in descending order if 'true', ascending order if 'false'."}, "error_msg": {"type": "boolean", "description": "Sort by error_msg in descending order if 'true', ascending order if 'false'."}}}, "per_page": {"default": 20, "minimum": 1, "type": "integer", "maximum": 1000}, "where": {"additionalProperties": false, "type": "object", "properties": {"complete": {"anyOf": [{"additionalProperties": false, "required": ["$ne"], "type": "object", "properties": {"$ne": {"type": ["boolean", "null"]}}}, {"additionalProperties": false, "required": ["$eq"], "type": "object", "properties": {"$eq": {"type": ["boolean", "null"]}}}, {"type": ["boolean", "null"]}, {"additionalProperties": false, "required": ["$in"], "type": "object", "properties": {"$in": {"minItems": 0, "items": {"type": ["boolean", "null"]}, "uniqueItems": true, "type": "array"}}}]}, "$uri": {"anyOf": [{"additionalProperties": false, "required": ["$ne"], "type": "object", "properties": {"$ne": {"pattern": "^\\/api\\/v1\\/analyses\\/[^/]+$", "type": "string"}}}, {"additionalProperties": false, "required": ["$eq"], "type": "object", "properties": {"$eq": {"pattern": "^\\/api\\/v1\\/analyses\\/[^/]+$", "type": "string"}}}, {"pattern": "^\\/api\\/v1\\/analyses\\/[^/]+$", "type": "string"}, {"additionalProperties": false, "required": ["$in"], "type": "object", "properties": {"$in": {"minItems": 0, "items": {"pattern": "^\\/api\\/v1\\/analyses\\/[^/]+$", "type": "string"}, "uniqueItems": true, "type": "array"}}}]}, "created_at": {"anyOf": [{"additionalProperties": false, "required": ["$gt"], "type": "object", "properties": {"$gt": {"type": "string", "format": "date-time"}}}, {"type": "string", "format": "date-time"}, {"additionalProperties": false, "required": ["$ne"], "type": "object", "properties": {"$ne": {"type": "string", "format": "date-time"}}}, {"additionalProperties": false, "required": ["$lt"], "type": "object", "properties": {"$lt": {"type": "string", "format": "date-time"}}}, {"additionalProperties": false, "required": ["$lte"], "type": "object", "properties": {"$lte": {"type": "string", "format": "date-time"}}}, {"additionalProperties": false, "required": ["$between"], "type": "object", "properties": {"$between": {"minItems": 2, "items": {"type": "string", "format": "date-time"}, "type": "array", "maxItems": 2}}}, {"additionalProperties": false, "required": ["$eq"], "type": "object", "properties": {"$eq": {"type": "string", "format": "date-time"}}}, {"additionalProperties": false, "required": ["$gte"], "type": "object", "properties": {"$gte": {"type": "string", "format": "date-time"}}}]}, "success": {"anyOf": [{"additionalProperties": false, "required": ["$ne"], "type": "object", "properties": {"$ne": {"type": ["boolean", "null"]}}}, {"additionalProperties": false, "required": ["$eq"], "type": "object", "properties": {"$eq": {"type": ["boolean", "null"]}}}, {"type": ["boolean", "null"]}, {"additionalProperties": false, "required": ["$in"], "type": "object", "properties": {"$in": {"minItems": 0, "items": {"type": ["boolean", "null"]}, "uniqueItems": true, "type": "array"}}}]}, "sample": {"anyOf": [{"additionalProperties": false, "required": ["$ne"], "type": "object", "properties": {"$ne": {"anyOf": [{"additionalProperties": false, "type": "object", "properties": {"$ref": {"pattern": "^\\/api\\/v1\\/samples\\/[^/]+$", "type": "string"}}}, {"type": ["string", "null"], "maxLength": 16}]}}}, {"additionalProperties": false, "required": ["$eq"], "type": "object", "properties": {"$eq": {"anyOf": [{"additionalProperties": false, "type": "object", "properties": {"$ref": {"pattern": "^\\/api\\/v1\\/samples\\/[^/]+$", "type": "string"}}}, {"type": ["string", "null"], "maxLength": 16}]}}}, {"anyOf": [{"additionalProperties": false, "type": "object", "properties": {"$ref": {"pattern": "^\\/api\\/v1\\/samples\\/[^/]+$", "type": "string"}}}, {"type": ["string", "null"], "maxLength": 16}]}, {"additionalProperties": false, "required": ["$in"], "type": "object", "properties": {"$in": {"minItems": 0, "items": {"anyOf": [{"additionalProperties": false, "type": "object", "properties": {"$ref": {"pattern": "^\\/api\\/v1\\/samples\\/[^/]+$", "type": "string"}}}, {"type": ["string", "null"], "maxLength": 16}]}, "uniqueItems": true, "type": "array"}}}]}, "job": {"anyOf": [{"additionalProperties": false, "required": ["$ne"], "type": "object", "properties": {"$ne": {"anyOf": [{"additionalProperties": false, "type": "object", "properties": {"$ref": {"pattern": "^\\/api\\/v1\\/jobs\\/[^/]+$", "type": "string"}}}, {"type": ["string", "null"], "maxLength": 16}]}}}, {"additionalProperties": false, "required": ["$eq"], "type": "object", "properties": {"$eq": {"anyOf": [{"additionalProperties": false, "type": "object", "properties": {"$ref": {"pattern": "^\\/api\\/v1\\/jobs\\/[^/]+$", "type": "string"}}}, {"type": ["string", "null"], "maxLength": 16}]}}}, {"anyOf": [{"additionalProperties": false, "type": "object", "properties": {"$ref": {"pattern": "^\\/api\\/v1\\/jobs\\/[^/]+$", "type": "string"}}}, {"type": ["string", "null"], "maxLength": 16}]}, {"additionalProperties": false, "required": ["$in"], "type": "object", "properties": {"$in": {"minItems": 0, "items": {"anyOf": [{"additionalProperties": false, "type": "object", "properties": {"$ref": {"pattern": "^\\/api\\/v1\\/jobs\\/[^/]+$", "type": "string"}}}, {"type": ["string", "null"], "maxLength": 16}]}, "uniqueItems": true, "type": "array"}}}]}, "analysis_type": {"anyOf": [{"additionalProperties": false, "required": ["$startswith"], "type": "object", "properties": {"$startswith": {"minLength": 1, "type": "string"}}}, {"type": ["string", "null"], "maxLength": 50}, {"additionalProperties": false, "required": ["$contains"], "type": "object", "properties": {"$contains": {"minLength": 1, "type": "string"}}}, {"additionalProperties": false, "required": ["$ne"], "type": "object", "properties": {"$ne": {"type": ["string", "null"], "maxLength": 50}}}, {"additionalProperties": false, "required": ["$iendswith"], "type": "object", "properties": {"$iendswith": {"minLength": 1, "type": "string"}}}, {"additionalProperties": false, "required": ["$icontains"], "type": "object", "properties": {"$icontains": {"minLength": 1, "type": "string"}}}, {"additionalProperties": false, "required": ["$endswith"], "type": "object", "properties": {"$endswith": {"minLength": 1, "type": "string"}}}, {"additionalProperties": false, "required": ["$istartswith"], "type": "object", "properties": {"$istartswith": {"minLength": 1, "type": "string"}}}, {"additionalProperties": false, "required": ["$in"], "type": "object", "properties": {"$in": {"minItems": 0, "items": {"type": ["string", "null"], "maxLength": 50}, "uniqueItems": true, "type": "array"}}}, {"additionalProperties": false, "required": ["$eq"], "type": "object", "properties": {"$eq": {"type": ["string", "null"], "maxLength": 50}}}]}, "error_msg": {"anyOf": [{"additionalProperties": false, "required": ["$startswith"], "type": "object", "properties": {"$startswith": {"minLength": 1, "type": "string"}}}, {"type": ["string", "null"], "maxLength": 255}, {"additionalProperties": false, "required": ["$contains"], "type": "object", "properties": {"$contains": {"minLength": 1, "type": "string"}}}, {"additionalProperties": false, "required": ["$ne"], "type": "object", "properties": {"$ne": {"type": ["string", "null"], "maxLength": 255}}}, {"additionalProperties": false, "required": ["$iendswith"], "type": "object", "properties": {"$iendswith": {"minLength": 1, "type": "string"}}}, {"additionalProperties": false, "required": ["$icontains"], "type": "object", "properties": {"$icontains": {"minLength": 1, "type": "string"}}}, {"additionalProperties": false, "required": ["$endswith"], "type": "object", "properties": {"$endswith": {"minLength": 1, "type": "string"}}}, {"additionalProperties": false, "required": ["$istartswith"], "type": "object", "properties": {"$istartswith": {"minLength": 1, "type": "string"}}}, {"additionalProperties": false, "required": ["$in"], "type": "object", "properties": {"$in": {"minItems": 0, "items": {"type": ["string", "null"], "maxLength": 255}, "uniqueItems": true, "type": "array"}}}, {"additionalProperties": false, "required": ["$eq"], "type": "object", "properties": {"$eq": {"type": ["string", "null"], "maxLength": 255}}}]}}}, "page": {"default": 1, "minimum": 1, "type": "integer"}}}}, {"targetSchema": {"$ref": "#"}, "href": "/api/v1/analyses/{id}", "method": "GET", "rel": "self"}]}